{
  "$schema": "./public-ax-cases.schema.json",
  "verified_at": "2026-08-01",
  "updated_at": "2026-10-26",
  "review_scope": {
    "reviewed_case_ids": [
      "K01",
      "K02",
      "K03",
      "K04",
      "K05",
      "K07",
      "K08",
      "K09",
      "K10",
      "K11",
      "K12",
      "K13",
      "K14",
      "K15",
      "K16",
      "G01",
      "G02",
      "G03",
      "G04",
      "G05",
      "G06",
      "G07",
      "G08",
      "G09",
      "G10",
      "G11",
      "G12",
      "G13",
      "G14",
      "G15",
      "G16",
      "G17",
      "G18",
      "G19",
      "G20",
      "G21",
      "G22",
      "G23",
      "G24"
    ],
    "scope": "selected-claims-only",
    "baseline_source_count": 26,
    "baseline_case_ids": [
      "K01",
      "K02",
      "K03",
      "K04",
      "K05",
      "K06",
      "K07",
      "K08",
      "K09",
      "K10",
      "G01",
      "G02",
      "G03",
      "G04",
      "G05",
      "G06",
      "G07",
      "G08",
      "G09",
      "G10",
      "G11",
      "G12",
      "G13",
      "G14",
      "G15"
    ]
  },
  "cases": [
    {
      "id": "K01",
      "region": "KR",
      "organization": "국민권익위원회 외",
      "workflow": {
        "ko": "민원 답변 추천과 중복 민원 군집화",
        "en": "Petition response drafts and duplicate clustering"
      },
      "industry": "public-sector",
      "source_type": "organization-official",
      "deployment_stage": "limited-operation",
      "outcome_verification": "none",
      "source_urls": [
        "https://www.korea.kr/news/policyNewsView.do?newsId=156743148"
      ],
      "related_cases": [
        "public-service-petition-response"
      ],
      "review_status": "selected-claims-reviewed",
      "claims": [
        {
          "id": "K01-baseline",
          "kind": "baseline-summary",
          "statement": {
            "ko": "2026-08-01 카탈로그에 기록한 업무: 민원 답변 추천과 중복 민원 군집화. 분류값과 기존 출처를 보존하며 이번에 전체 내용을 다시 검증하지 않았다.",
            "en": "Workflow recorded in the 2026-08-01 catalog: Petition response drafts and duplicate clustering. The original classifications and sources are preserved; the full entry was not reverified in this review."
          },
          "source_urls": [
            "https://www.korea.kr/news/policyNewsView.do?newsId=156743148"
          ],
          "published_at": null,
          "checked_at": "2026-08-01",
          "access_status": "not-rechecked",
          "temporal_relation": "baseline",
          "status": "historical-unrechecked",
          "observation_period": {
            "start": null,
            "end": null,
            "description": {
              "ko": "기존 원문의 관측기간은 이번에 다시 확인하지 않았다.",
              "en": "The original observation period was not rechecked."
            }
          },
          "sample": {
            "size": null,
            "description": {
              "ko": "기존 자료의 표본과 분모는 이번에 다시 확인하지 않았다.",
              "en": "The original sample and denominator were not rechecked."
            }
          },
          "method": {
            "status": "not-rechecked",
            "description": {
              "ko": "원문과 측정 방법을 이번에 다시 확인하지 않았다.",
              "en": "The source and measurement method were not rechecked."
            }
          },
          "limitations": [
            {
              "ko": "기존 카탈로그의 보존 기록이며 2026-10-26 현재 상태를 뜻하지 않는다.",
              "en": "This preserves the earlier catalog; it does not establish the state on 2026-10-26."
            }
          ]
        },
        {
          "id": "K01-source-confirmation",
          "kind": "source-confirmation",
          "statement": {
            "ko": "일부 기관의 시범 운영과 담당자의 초안 수정·민원 묶음 선택을 원문에서 확인했다.",
            "en": "The source confirms a pilot at selected agencies and caseworker control over drafts and petition groups."
          },
          "source_urls": [
            "https://www.korea.kr/news/policyNewsView.do?newsId=156743148"
          ],
          "published_at": "2026-02-05",
          "checked_at": "2026-10-26",
          "access_status": "read",
          "temporal_relation": "pre-baseline-new-evidence",
          "status": "source-reported",
          "observation_period": {
            "start": null,
            "end": null,
            "description": {
              "ko": "세부 관측기간은 공개하지 않았다.",
              "en": "Detailed observation dates are not reported."
            }
          },
          "sample": {
            "size": null,
            "description": {
              "ko": "평가 표본과 분모는 공개하지 않았다.",
              "en": "Evaluation sample and denominator are not reported."
            }
          },
          "method": {
            "status": "reported",
            "description": {
              "ko": "발표 주체의 설명이며 독립 평가가 아니다.",
              "en": "Publisher’s account, not an independent evaluation."
            }
          },
          "limitations": [
            {
              "ko": "이번 확인은 위 주장과 원문의 대조다. 기존 이력은 유지하며 성과를 독립 검증했다고 보지 않는다.",
              "en": "This checks the stated claim against its source; it preserves history and does not independently verify outcomes."
            }
          ]
        }
      ],
      "baseline_deployment_stage": "limited-operation"
    },
    {
      "id": "K02",
      "region": "KR",
      "organization": "신한은행",
      "workflow": {
        "ko": "법인 여신 분석과 의견서 작성 지원",
        "en": "Corporate credit analysis and opinion drafting"
      },
      "industry": "financial-services",
      "source_type": "organization-official",
      "deployment_stage": "limited-operation",
      "outcome_verification": "none",
      "source_urls": [
        "https://www.shinhangroup.com/kr/archive/press/detail/679"
      ],
      "related_cases": [
        "credit-underwriting-review"
      ],
      "review_status": "selected-claims-reviewed",
      "claims": [
        {
          "id": "K02-baseline",
          "kind": "baseline-summary",
          "statement": {
            "ko": "2026-08-01 카탈로그에 기록한 업무: 법인 여신 분석과 의견서 작성 지원. 분류값과 기존 출처를 보존하며 이번에 전체 내용을 다시 검증하지 않았다.",
            "en": "Workflow recorded in the 2026-08-01 catalog: Corporate credit analysis and opinion drafting. The original classifications and sources are preserved; the full entry was not reverified in this review."
          },
          "source_urls": [
            "https://www.shinhangroup.com/kr/archive/press/detail/679"
          ],
          "published_at": null,
          "checked_at": "2026-08-01",
          "access_status": "not-rechecked",
          "temporal_relation": "baseline",
          "status": "historical-unrechecked",
          "observation_period": {
            "start": null,
            "end": null,
            "description": {
              "ko": "기존 원문의 관측기간은 이번에 다시 확인하지 않았다.",
              "en": "The original observation period was not rechecked."
            }
          },
          "sample": {
            "size": null,
            "description": {
              "ko": "기존 자료의 표본과 분모는 이번에 다시 확인하지 않았다.",
              "en": "The original sample and denominator were not rechecked."
            }
          },
          "method": {
            "status": "not-rechecked",
            "description": {
              "ko": "원문과 측정 방법을 이번에 다시 확인하지 않았다.",
              "en": "The source and measurement method were not rechecked."
            }
          },
          "limitations": [
            {
              "ko": "기존 카탈로그의 보존 기록이며 2026-10-26 현재 상태를 뜻하지 않는다.",
              "en": "This preserves the earlier catalog; it does not establish the state on 2026-10-26."
            }
          ]
        },
        {
          "id": "K02-source-confirmation",
          "kind": "source-confirmation",
          "statement": {
            "ko": "여신 검토 지원 도입을 확인했다. 12개 업종은 분석 범위이며 직원의 최종 판단을 대체한다는 설명은 없다.",
            "en": "Deployment supports credit review; twelve industries describe coverage, not an evaluation sample or autonomous approval."
          },
          "source_urls": [
            "https://www.shinhangroup.com/kr/archive/press/detail/679"
          ],
          "published_at": "2026-03-27",
          "checked_at": "2026-10-26",
          "access_status": "read",
          "temporal_relation": "pre-baseline-new-evidence",
          "status": "source-reported",
          "observation_period": {
            "start": null,
            "end": null,
            "description": {
              "ko": "세부 관측기간은 공개하지 않았다.",
              "en": "Detailed observation dates are not reported."
            }
          },
          "sample": {
            "size": null,
            "description": {
              "ko": "평가 표본과 분모는 공개하지 않았다.",
              "en": "Evaluation sample and denominator are not reported."
            }
          },
          "method": {
            "status": "reported",
            "description": {
              "ko": "발표 주체의 설명이며 독립 평가가 아니다.",
              "en": "Publisher’s account, not an independent evaluation."
            }
          },
          "limitations": [
            {
              "ko": "이번 확인은 위 주장과 원문의 대조다. 기존 이력은 유지하며 성과를 독립 검증했다고 보지 않는다.",
              "en": "This checks the stated claim against its source; it preserves history and does not independently verify outcomes."
            }
          ]
        }
      ],
      "baseline_deployment_stage": "limited-operation"
    },
    {
      "id": "K03",
      "region": "KR",
      "organization": "신한라이프",
      "workflow": {
        "ko": "대화형 가입설계와 전산심사",
        "en": "Conversational policy design and automated checks"
      },
      "industry": "financial-services",
      "source_type": "organization-official",
      "deployment_stage": "limited-operation",
      "outcome_verification": "self-reported",
      "source_urls": [
        "https://shinhangroup.com/kr/archive/press/detail/637"
      ],
      "related_cases": [
        "credit-underwriting-review"
      ],
      "review_status": "selected-claims-reviewed",
      "claims": [
        {